"Id","Region","River Name","Section","Class","Class (decimal)","Length","Gradient","Time","Put in","Take out","Body"
"https://rivers.org.nz/nz/southland/tutoko/to-tutoko-road-bridge","Southland","T","River Flats to T","IV+","4.25","2.5km","","1.5-2 hours","See the description.","Tutoko road bridge","<p>Dr James Hector, a geologist for the Otago Provincial Government bestowed the name Tutoko on this stunning mountain and river valley.during his explorations in 1863. Chief Tutoko and his family lived at a small pa in Martins Bay at the time hector was trying to find a pass out of the Milford area. He had explored the upper Cleddau only to be, <em>""repelled by a wall of mountains.""</em></p><p>The most popular option is the lower section (see beta box). This offers the best of the Tutoko experience. Tight class IV boulder gardens, all boat scoutable and in a gob smacking locale. It is possible to walk into the upper reaches of the river which, reportedly, has much more class V and more portages "
"https://rivers.org.nz/nz/bay-of-plenty/waiari/waiari-gorge","Bay of Plenty","Waiari","Waiari Gorge","II-III","2.5","","","","","","<p>River is Waiari Steam. Put-in and take-out off Te Matai Road.<br />Trip report in Waikato Kayak Club, Sept 2006.<br /><a href=""http://www.waikatokayakclub.org.nz/newsletters/archive/2006/WKC_Sep06.pdf"" title=""http://www.waikatokayakclub.org.nz/newsletters/archive/2006/WKC_Sep06.pdf"">http://www.waikatokayakclub.org.nz/newsletters/archive/2006/WKC_Sep06.pdf</a> (PDF, 450KB)<br /><a href=""http://maps.google.com/maps?f=q&hl=en&ie=UTF8&om=1&z=13&ll=-37.824565,176.314774&spn=0.074034,0.177326&t=h&iwloc=A"" title=""http://maps.google.com/maps?f=q&hl=en&ie=UTF8&om=1&z=13&ll=-37.824565,176.314774&spn=0.074034,0.177326&t=h&iwloc=A"">http://maps.google.com/maps?f=q&hl=en&ie=UTF8&om=1&z=13&ll=-37.824565,17...</a></p>"
"https://rivers.org.nz/nz/west-coast/waiatoto/bonar-flats-to-waiatoto-bridge","West Coast","Waiatoto","Bonar Flats to Waiatoto Bridge","III-IV","3.5","40km","4m/km","2 -3 days (approx 12 hours of paddling)","Bonar Flats","Waiatoto Road Bridge","<p>The Waiatoto drains the Volta Glacier system on the western side of Mount Aspiring National Park. The main reason for a Waiatoto trip is to enjoy the unbelieveable wilderness of south Westland with a group of friends and enjoy it with some good food and wine. There is some fun whitewater too! Most trips start at the Bonar Flats. A short gorge between this point and the next flats - Donald Flats - contains some classic class III boulder hopping that adds hydro interest to the scenery. The river is easy and becomes braided in the section down to the Drake River confluence. </p><p>The crux of the Waiatoto whitewater comes in the next five or six kilometres to Ferny Flats. Most of the action is at the start of the gorge and is in the class IV range (harder with higher flows), with portaging options if necessary. Once clear of the gorge proper the river widens into long, pleasant class II-III bouldergardens. There may be some boulder chokes in this section if the water level is very low.  Be wary of tree hazards especially in the easy water.  In 1978 a huge rockslide fell into the source lake and sent a biblical sized wall of water, ice blocks and debris down the river, wiping out a number of huts and forging new channels through mature forest. The tree stumps date back to this event.</p><p>Many parties spend the night on the Axius Flats at the Te Naihi River confluence where the fishing is superb. From Axius Flats to the Palmer River confluence there"
"https://rivers.org.nz/nz/canterbury/waiau/lower-waiau","Canterbury","Waiau","Lower Waiau","II-II+","2.15","14km","4m/km","2-3 hours","above Waiau Gorge Bridge, river left","Waiau River Bridge on Leslie Hills road","<p>A classic beginner"
"https://rivers.org.nz/nz/canterbury/waiau/upper-waiau","Canterbury","Waiau","Upper Waiau","III-IV+","3.7","45km","11m/km","2-4 days","Maling Pass (helicopter, 4WD or walking)","SH7 after the Hope confluence","<p>It doesn"
"https://rivers.org.nz/nz/canterbury/waiau/hope-to-hanmer","Canterbury","Waiau","Hope to Hanmer","II-III","2.5","","","","Hope Bridge on SH7","Hanmer river confluence","<p>Put-in on Hope River. Paddle past Waiau confluence.<br />Put-in <a href=""http://www.topomap.co.nz/NZTopoMap?v=2&ll=-42.587674,172.452816&z=13"" title=""http://www.topomap.co.nz/NZTopoMap?v=2&ll=-42.587674,172.452816&z=13"">http://www.topomap.co.nz/NZTopoMap?v=2&ll=-42.587674,172.452816&z=13</a><br />Take-out: <a href=""http://www.topomap.co.nz/NZTopoMap?v=2&ll=-42.579427,172.783522&z=14"" title=""http://www.topomap.co.nz/NZTopoMap?v=2&ll=-42.579427,172.783522&z=14"">http://www.topomap.co.nz/NZTopoMap?v=2&ll=-42.579427,172.783522&z=14</a></p>"
"https://rivers.org.nz/nz/canterbury/waiau/leslie-hills-to-waiau","Canterbury","Waiau","Leslie Hills to Waiau","II","2","","","","","",""
"https://rivers.org.nz/nz/canterbury/waiau/waiau-to-sh1","Canterbury","Waiau","Waiau to SH1","II","2","","","","","",""
"https://rivers.org.nz/nz/canterbury/waiau/sh1-to-sea","Canterbury","Waiau","SH1 to sea","II","2","","","","","",""
"https://rivers.org.nz/nz/west-coast/waiho/franz-josef-glacier-to-sh6","West Coast","Waiho","Franz Josef Glacier to SH6","III+","3.25","4.5km","15m/km","1.5-2 hours","Franz Josef Glacier Road end.","SH6 Bridge over Waiho River.","<p>The Waiho is a less intense excursion than the neighboring Fox River just over the hill. This frigid stretch of water is rafted by companies based at Franz Josef and is a good section to try if you have never paddled the other ice-capades on offer. </p><p>It certainly makes a good warm-up (??) for the Fox if you are unsure about your ability to handle intense cold and increased difficulty. The rapids are fun in a weird sort of way - rafting companies must have the greatest marketing strategy in the world to entice people to pay to float down this icewater hydroslide. Mostly even gradient wave chains will roll you down from the put in to the bridge. Higher flows will see the same style of rapids, but much bigger and more confused water will ensure your frontal lobes won"
"https://rivers.org.nz/nz/waikato/waihohonu/sh1-to-waihohonu-intake","Waikato","Waihohonu","SH1 to Waihohonu intake","III","3","3.5km","16m/km","1-2 hours","Waihohonu bridge, SH 1","Waihohonu Intake strcture","<p>The Waihohonu, which literally means "
"https://rivers.org.nz/nz/marlborough/waihopai/powerhouse-to-avon-valley-road","Marlborough","Waihopai","Powerhouse to Avon Valley Road","II-III+","2.6","8km","7.5m/km","1-2","Waihopai Power House","Avon Valley Road","<p>When the water is there the Waihopai is a very good little run and people travel from far and wide in Marlborough to catch some surfing and fun playing.</p><p>Squirly water through a narrow canyon with nothing harder than class III+ starts the run from below the Power House. In lower water a small drop adds a good feel to the canyon and run in general. I remember the day I first ran this little drop as a student in Blenheim. A team of us had psyched up for ages and portaged every other time. Finally it went "
"https://rivers.org.nz/near_putaruru","Waikato","Waihou","Near Putaruru","II","2","","","","","","<p><a href=""http://www.nzherald.co.nz/section/story.cfm?c_id=1&ObjectID=10405750Don't"" title=""http://www.nzherald.co.nz/section/story.cfm?c_id=1&ObjectID=10405750Don't"">http://www.nzherald.co.nz/section/story.cfm?c_id=1&ObjectID=10405750Don't</a> know much about this. Mostly placid through farmland, but a dangerous gorge with a natural dam near Putaruru.URL is a place-holder until we can identify the regular section(s).</p>"
"https://rivers.org.nz/nz/southland/waikaia/post-office-creek-to-piano-flat","Southland","Waikaia","Post Office Creek to Piano Flat","II","2","","","","","","<p>The lower section between Post Office Creek and Piano Flat has long been used by the Southland Canoe Club and is a good but short class-II run with a handful of rapids, heaps of eddies, clear pools and nice scenery. To put in for this run, park at the small clearing 300m before the Post Office Creek bridge, then it"
"https://rivers.org.nz/nz/southland/waikaia/west-branch-waikaia","Southland","Waikaia","West Branch Waikaia","V-V+","5.2","5km","80m/km","3-8 hours","Gorge / stream confluence","Canton Bridge","<p>Quite within his bounds, Keith Riley says this is one of the most exciting pieces of whitewater in the country, the only detrazction being the 2-3 hour walk to the put-in. Fortunately, Keith et al didn't check the gradient before they left or they'd probably never have gone. Dropping at over 70m/km for 2km, this <strong>STEEP</strong> run out-steeps the steepest on the Coast so far (except for Falls Creek now!). It has countless drops, all big and clean, with not much space between them. Yet all are surprisingly runnable, portageable and scoutable. The gradient eases considerably after the east branch confluence. From there to the take-out at Canton Bridge is about an hour. The entire trip takes about 5 hours with just above normal flow (0800mm) being ideal.</p><p>To get to the west branch: from the Canton Bridge, slog up the hill on the right-hand side. Head across the tussocky plains making a bee line for the gorge/stream confluence. The topography makes it fairly clear where this is, but don"
"https://rivers.org.nz/nz/southland/waikaia/canton-bridge-to-piano-flat","Southland","Waikaia","Canton Bridge to Piano Flat","IV-V","4.5","12km","60m/km","3-8 hours","Canton Bridge","Piano Flat campground","<p>Central Southland is not renowned for its classic whitewater runs, perhaps due to their complete absence"
"https://rivers.org.nz/nz/hawkes-bay/waikaretaheke/piripaua","Hawke's Bay","Waikaretaheke","Piripaua","II-III","2.5","","","","","","<p>Whitewater NZ assists the <a href=""http://www.hbcc.org.nz/"">Hawkes Bay Canoe Club</a> and <a href=""http://www.genesisenergy.co.nz/"">Genesis Energy</a> to organise releases on the Piripaua section of the Waikaretaheke River. Please register by completing the form at <a href=""http://nzrivers.wufoo.com/forms/register/"" title=""http://nzrivers.wufoo.com/forms/register/"">http://nzrivers.wufoo.com/forms/register/</a></p>"
"https://rivers.org.nz/nz/hawkes-bay/waikaretaheke/whakamarino","Hawke's Bay","Waikaretaheke","Whakamarino","III-IV","3.5","","","","","","<p>This section does not have enough water for kayaking except for those dates when releases are provided by Genesis Energy.</p>"
"https://rivers.org.nz/lower","Hawke's Bay","Waikaretaheke","Lower","IV-V","4.5","","","","","","<p>Approximately 15km from Waikaremoana towards Wairoa the river suddenly drops over a bedrock shelf creating a hydro slide rapid that culminates into a 2m horseshoe shaped waterfall. The lead in to this waterfall is tricky and not without consequences. Strainers on either side block most of the downstream flow and will need proper scouting and safety. Once the trees are negotiated with you will have about 7m left to sort your line out down the waterfall. What the drop lacks in height and volume it could make up for carnage. The boil-line appears about a creek boat"
"https://rivers.org.nz/nz/waikato/waikato/huka-falls","Waikato","Waikato","Huka Falls","IV-V+","4.61","0.5km","","","Upstream from Huka Falls","Lake Aratiatia","<p>One for you waterfall huckers out there. Get hard, be brave and try some new trick off the edge if you dare.</p><p>It is a fun outing and most people catch the falls at low flows (35-80cumecs) for their first time. The lead in is quite manageable and there is plenty of time to hit the left line at the finish. It is possible to flat land the drop and keep your face dry "
"https://rivers.org.nz/nz/waikato/waikato/aratiatia","Waikato","Waikato","Aratiatia","V-VI","5.5","","","","Aratiatia dam","Rapids Rd","<p>Aratiatia is just downstream of Huka Falls. Water is released twice a day and gives wanna-be suitors a good chance to see how the rapids form and what level of challenge they are prepared to take on. It is a serious proposition and requires strategically placed throw baggers at a couple of places.</p><p>The technical/commitment crux comes at the weir halfway down. This ghastly hydraulic has seen some very hyperactive paddling from those caught in its backwash. Establishing an acknowledged grading of Aratiatia is difficult "
"https://rivers.org.nz/nz/waikato/waikato/ngawapurua","Waikato","Waikato","Ng","II+","2.25","","","","","","<p>The site of the 1999 World Freestyle Championships, the Nga Awa Purua wave is best at 180 to 240 cumecs. Phone 0800 820 082</p><p>Permission is needed for access on Tauhara North No. 2 Trust land downstream of the ""Hay Barn"".</p><p>Also called Fulljames after Walter Leslie Fulljames<br /> (<a href=""http://muse.aucklandmuseum.com/databases/Cenotaph/18811.detail"" title=""http://muse.aucklandmuseum.com/databases/Cenotaph/18811.detail"">http://muse.aucklandmuseum.com/databases/Cenotaph/18811.detail</a>).</p><p>Contact for access:<br />Forest & General Security Ltd,<br />63 Miro St<br />Taupo<br />Phone 07-376 5333.</p>"
"https://rivers.org.nz/nz/waikato/waikato/reids-farm","Waikato","Waikato","Reids Farm","I+","1.25","","","","","","<p>Permanent slalom course, close to Taupo.</p>"
"https://rivers.org.nz/nz/waikato/waikato/control-gates-to-reids-farm","Waikato","Waikato","Control Gates to Reids farm","I-II","1.5","","","1 - 2 hours","Control Gates","Reids Farm",""
"https://rivers.org.nz/nz/manawatu/waikawa/waikawa-stream","Manawatu","Waikawa","Waikawa Stream","III-IV+","3.7","3km","30m/km","15mins - 1hour","Top of North Manakau Rd","Just above the ford at Waikawa Stream Recreation Area","<p>The Waikawa stream is probably the best creek in the region when it's been raining steady and the rivers are on.</p><p>If its over 900mm then its going but 900mm is low so expect some scrapy class III-IV action at those kind of flows, but it gets better as water levels go up. When the river is charging around 1,600mm and over expect a non-stop run with a big water feel even though the river is only four or so meters wide at most points and still often only a couple of feet deep.</p><p>Once at the take-out check out the ford; if the water is not flowing under the ford then dont bother driving up to the put-in.</p><p>Be sure to leave a couple of cars at the bottom if its high, you won't be able to resist lapping the run. On the shuttle up to the top you can check out most of the river from high up for wood, seems to attract very little.</p><p>From the top carpark walk up the track alongside the river for five minutes till it drops down to meet the river at a big fork.</p><p>The river starts off with fast moving grade II-III water before it drops into some cool class IV rapids which are a quick warm up for the Car rapid, a 250m stretch of what could be described as a class IV+ rollercoaster.</p><p>Hold on tight and be sure not to swim if it's high. In low water most of the rapid can be scouted river left (keep a eye out for the rapid's namesake). After this rapid the action eases off a bit with a couple more classy III-IV's before easing off to flatter water.Watch for branches in the last of the paddle out, then take out river right directly above the ford. The gradient is 42m/km for first 2km then 5m/km for last kilometre of flat water (class I).</p><p>To get to the take-out: On SH1 in Manakau on the eastern side of the road turn onto North Manakau Road then drive approximately 3.5km till you see a sign for the Waikawa stream recreational reserve. Park down in the gravel car park by the river.</p><p>To get to the put-in: Drive back out of the reserve then carry on heading up the road until the end of the tarmac. There should be a gate onto a gravel road, pass through making sure to leave the gates as they were, and carry on right till the end. From here walk the five minutes along the track to the put in at the river junction.</p>"
"https://rivers.org.nz/nz/northland/waima/waima","Northland","Waima","Waima","I","1","","","","","","<p>RUS 1113, class unknown</p>"
"https://rivers.org.nz/nz/northland/waima/to-donnellys-crossing","Northland","Waima","To Donnellys Crossing","IV-IV+","4.1","6km","","1-4 hours","Top end of Waima River Road where the road becomes 4WD track and the river is visible down a grass padd","Donnellys Crossing","<p>The Waima is another of Northland's secret gems! Key things to note without giving away the adventure of paddling the river:</p><ul><li>There is a 100 foot waterfall above the put in mentioned.</li><li>The action is steep and clean, eddies are few but good ones where necessary.</li><li>Kauri forest is amazing.</li><li>There is a second gorge! Once the action seems to flatten for about 1.5km brace yourself for the second gorge! Look before committing.</li></ul><p>You can walk back up derelict old road following the river to get back to put in if only have one car (approx 1.5hr walk).</p>"
"https://rivers.org.nz/nz/canterbury/waimakariri/mount-white-bridge-to-gorge-bridge","Canterbury","Waimakariri","Mount White Bridge to Gorge Bridge","II","2","","","","Mount White Bridge of SH73 north of Cass","Gorge Bridge on Waimakariri Gorge Road, north of Sheffield","<p>After wide open, braided flows near Bealey the river carves through a spectacular gorge through the Torlesse Range. The river passes through a number of massive rock cliffs down through the Carrington Gorge, which ends with Hamilton Rapids, where the gorge opens out a little with rocky beaches. The river continues down past rocky bluffs and scrub covered hill sides to Broken River, where there is another narrow gorge section. Thereafter the river widens out, passes down through the wide Horseshoe Bend and then into Otarama Gorge down to Woodstock and further on down to the Gorge Bridge across from Sheffield.</p><p>The run from Mt White Bridge down to Woodstock or the Gorge Bridge is one of the classic overnight kayaking or rafting trips in New Zealand and is Class II-III. The Gorge is spectacular and the water not too difficult (Hamilton rapid is Class II-III depending on flow) although in very high flows e.g., 1500 cumecs or so, the river takes on the big water character and features rivalling those of the Grand Canyon of the Colorado of the USA (25 foot high waves) and becomes Class IV-V! The river is frequently rafted and is also catarafted and has been floated in dinghies. This stretch is also used in the Coast to Coast multisport race and after downriver racing paddlers the main users of the river are jet boaters.</p>"
"https://rivers.org.nz/nz/canterbury/waimakariri/gorge-bridge-to-sh1-bridge","Canterbury","Waimakariri","Gorge Bridge to SH1 Bridge","I","1","","","","","","<p>WWCC Brass Monkey Race is held here. Faces reduced flows if CPW scheme proceeds. The reach from the Gorge Bridge to the SH1 Bridge (or subsets of it) is widely used by jet boaters and down river racing paddlers, particularly for training. Willows on river banks can be a hazard at times as can river protection works and most of the rapids are relatively straight forward although significant turbulence sometimes occurs where braided channels re-join.</p>"
"https://rivers.org.nz/nz/tasman/waingaro/forks-hut-to-hamama-road","Tasman","Waingaro","Forks Hut to Hamama Road","III-IV","3.5","20km","40m/km","6 -7 hrs from Forks Hut","Forks Hut","Farm track at Hamama Rd or Paynes Ford bridge","<p>The Waingaro is a tributary of the Takaka. It"
"https://rivers.org.nz/nz/bay-of-plenty/wainui/wainui","Bay of Plenty","Wainui","Wainui","V-V+","5.2","8.5km","60m/km","5-6hrs","Tim Rd by farm","Wainui Bridge on SH2","<p>The premiere steep creek run in the North Island, with 20m waterfall.</p><p>Rapids: B's rapid, Freight Train, Double Drop, Little Brother, Big Guy,</p>"
"https://rivers.org.nz/nz/bay-of-plenty/waioeka/sh2-to-opotiki","Bay of Plenty","Waioeka","SH2 to Opotiki","I-II+","1.6","28.5km","5m/km","5-8 hours, or do it over two days","junction of wairata Road and SH 2","","<p>The second run, known as Hells Gate starts below Wairata, off SH2. The rapids are all class I-II+. Although the river flows alongside the road it still has a wilderness feel about it with plenty to offer novice and intermediate paddlers in play boats. Both runs gain a half to full class rating when in flood.</p><p>To get to the put in: find the turn off to Koranga and the Moanui Valley off SH2 about 9km east of Matawai, (or 60kmeast of Opotiki). Turn onto this gravel road. In less than a kilometre the road forks. Take the right fork and follow signs along Moanui Valley Rd. This road winds down alongside Moanui Stream. Follow this to its end, park where you see a sign informing you of Urewera National Park access in a large turnaround, this is the put in.</p><p>To get to the take out: With plenty of water in the river you can paddle to the Waioeka River/SH2 junction at Wairata. If the water is low, or you just can't be bothered, it is possible to cut the trip shorter by turning off SH2 at Wairata and driving about 4km up the gravel road to any point available for exiting the river.</p>"
"https://rivers.org.nz/nz/bay-of-plenty/waioeka/koranga-to-sh2","Bay of Plenty","Waioeka","Koranga to SH2","III","3","28.5km","5m/km","5-8 hours, or do it over 2 days","on the Moanui Valley Road, by a footbridge where the road first meets the river","junction of Waitara Road","<p>One of the best full river trips in the region.</p><p>Flowing through the remote backblocks of the East Cape, the upper stretches of the Waioeka River have some quality continuous whitewater. ""It's definitely well worth the effort"" says local boy and hard man Zak Shaw. High praise for this little known river on the boundary of Te Urewera National park.</p><p>The whole run can be done in a long day or split into a two day trip if you want the journey experience. To kayak the upper section put in on Koranga Stm (one of the main tributaries) from the road end to Moanui Station. The Koranga itself is fun with steep and tight rock garden rapids, all of which can be boat scouted. The most difficult rapid is about 1km above the confluence.</p><p>Once at the Waioeka Forks the action eases for an hour or so of open shingle rapids. The river then picks up with numerous rocky rapids and chutes all within the class III realm. The best take out is on Waitara Rd.</p><p>To get to the put in: find the turn off to Koranga and the Moanui Valley off SH2 about 9km east of Matawai, (or 60km east of Opotiki). Turn onto this gravel road. In less than a kilometre the road forks. Take the right fork and follow signs along Moanui Valley Rd. This road winds down alongside Moanui Stream. Follow this to its end, park where you see a sign informing you of Urewera National Park access in a large turnaround, this is the put in </p><p>To get to the take out: With plenty of water in the river you can paddle to the Waioeka River/SH2  junction at Waitara. If the water is low, or you just can't be bothered, it is possible to cut the trip shorter by turning off SH2 at Waitara and driving about 4km up the gravel road to any point available for exiting the river.</p>"
"https://rivers.org.nz/nz/wellington/waiohine/top-forks-to-waiohine-gorge-road","Wellington","Waiohine","Top Forks to Waiohine Gorge Road","III+ (IV-)","3.26","","","","","",""
"https://rivers.org.nz/nz/waikato/waipapa/waipapa","Waikato","Waipapa","Waipapa","II","2","","","","","","<p>RUS 1111</p>"
"https://rivers.org.nz/waipapa","Waikato","Waipapa River","To Waipapa Lake","II (IV)","2.22","","","","","","<p>Another quite interesting paddle is the Waipapa River near Mangakino which doesn"
"https://rivers.org.nz/nz/west-coast/waipara/source-lake-to-arawhata","West Coast","Waipara","Source lake to Arawhata Road Bridge","IV+ (V)","4.3","20km","24m/km","2-3 days","Source lake or below Cabin Pass rapids of there is not enough water.","Arawhata Road Bridge","<p>The Waipara is a beautiful, isolated valley which drains the Bonar Glacier in Mount Aspiring National Park. The river takes you from the ice filled neve lake to the Tasman Sea (if you paddle the last section from the road bridge). The very long walk out in untracked valley if things go wrong and the sheer isolation provide a great sense of commitment and add to the ambience of the Waipara River.</p><p>First paddled during 95/96 by Sean Waters, Jo Kippax, Rich Kersel and James McKeown in a three-day session only after convincing the helicopter pilot to keep flying higher, even though he told them they would die. They flew to the lake and began from there. Five years passed before a team went in for the second visit and paddled out in two easy days.</p><p>The Cabin Pass rapids leading out of the lake need a spring melt or a little rain. Best described as "
