"Id","Region","River Name","Section","Class","Class (decimal)","Length","Gradient","Time","Put in","Take out","Body"
"https://rivers.org.nz/nz/wellington/hutt/hutt-gorge","Wellington","Hutt","Hutt Gorge","III-IV","3.5","9.5km","7.5m/km","2-4 hours depending on play time","Kaitoke Regional Park off SH2 just before Rimutakas, North of Upper Hutt","Near water supply/Twin Lakes/Te Marua speedway, turn left off SH2 at Te Marua Golf Club then turn left again at the first water supply building.","<p>Hutt Gorge is the closest class III to the capital of NZ, Wellington. It needs a northwest fresh or sustained southerly rain to be runnable (over 1.8m on the Te Marua gauge). Above 2.7m on this gauge it is a harder run (class IV) with plenty of holes and few eddies so you need to know where the holes are going to be.</p><p>At normal flows (2.0-2.5m) the Gorge is like a wilderness run even though it is close to Upper Hutt (and Wellington). After putting in on the Pakuratahi River next to the Regional Park car park (toilets) and smiling at the tourists who flock to the LOTR filming sites, there is a km of class II-III. Once you get to the last (flume) bridge it is time to make sure everryone is ""OK"" because walking out after this point is difficult. Logs are common in the Gorge and scouting of blind drops is mandatory unless you have prior recent knowledge. The logs shift in every flood so don't be tricked into thinking you know the river from six months ago.</p><p>After leaving the flume bridge the river flows around to the left where the first drop occurs. In 2007, this drop has no log in it and is really just a chute.  The easy but fast water and drops continue for 300m before the river goes left. This leads to the site of a recent (October 2007) pinning and overnight stay due to logs in the main flow. The offending logs have since been trimmed but have not yet moved so <em>this rapid is a mandatory scout and/or portage</em> depending on flows. Above 2.0m there is a line on the right or if you feel lazy you can go over the log. Below 2.0m portage is the only option. This rapid is now called Westpac in recognition of 2 recent chopper rescues. </p><p>Another 400m takes you through Anne's Drop (now small at normal flows) and down to the ""Weir"". This is a generally friendly river-wide log weir which is a great play spot for everyone. A great place to let off some steam and have a go.</p><p>The river then turns right down several chutes to a big pool which ends at the confluence of Putaputa Stream (enters on right) where there is a sharp left turn. The gradient steepens with a small drop then onto the rock gardens and after a right turn you enter the Chicayne Rapid. The usual line is left of the big rock in the middle. After this chute it's time to eddy out and do your best to scout the Log Drop. This is a riverwide rata log which lodged itself here about two years ago (2005?) and has created an extra degree of challenge for newbies on the Gorge. At low flow the best option is to portage on river right. At 2.0m it is not practical to portage and best to run it middle left. At high flows there is a car-eating hole on  river left so you need to keep right!</p><p>There is a big pool after the Log Drop then comes the Toilet Bowl - a steep tongue on river right is the easiest route or if you feel like a harder line go left.</p><p>From here is roughly 2km of easy class III with some play spots  which switch on and off depending on the flow.  In here is a nice class III drop called Pinball? which occurs on a left hand bend and is just above a play spot we used to call Woodies Wave?</p><p>Another 500m and you are at the half way point. The grade from here on is  easy class III but log danger can change this of course. After Kororipo Stream (enters right) the grade drops off even more until the last half hour or so is easy class II.</p><p>At flows above 2.1m the second half of the run is still good fun.</p><p>Take out when you get to the car park. There is a big pool where kayakers gather before running the next (learners) section called the Twin Lakes run.</p><p>The Hutt Gorge contains a variety of drops and waves. It is wisest to run it on a dropping river as the narrow gorge can fill up quickly and the grade can change appropriately. The scenery is awesome. Every time we take a new paddler down they can't believe  this is all so close to Wellington. But of course it is rain dependent so be prepared to sacrifice something to get to the Gorge!</p>"
"https://rivers.org.nz/nz/wellington/hutt/twin-lakes-to-mangaroa","Wellington","Hutt","Twin Lakes to Mangaroa","II","2","","","1-2 hours","At the take out for Hutt Gorge run - turn left off SH2 at Te Marua Golf Club","Either at Mangaroa Stream confluence beside SH2 or further down where Akatarawa River joins (at Twin Bridges)","<p>The Twin Lakes run traditionally begins at the take out for the much harder <a href=""/nz/wellington/hutt/hutt-gorge"">Hutt Gorge run</a> and ends at the Hutt Valley CC rooms along Black Beech street in Birchville, Upper Hutt.</p><p>Alternatively you can take out half way down at the confluence of Mangaroa Stream beside SH2. The section from the Mangaroa Stream down to the Akatarawa confluence (Twin Bridges) is known as the Junction section. Then if you continue downstream for another 2km you arrive at the steps on river left to the HVCC clubrooms.</p><p>Twin Lakes is easy class II with several fast moving rapids but no serious drops or good play spots at normal flows. Danger comes from willows and riverworks and learners should not be allowed to lead for this reason. At one spot you can have fun gathering golf balls.</p><p>Take out as mentioned above at the Akatarawa confluence (also known as Twin Bridges) on river left or continue down to HVCC clubrooms (river left). </p>"
"https://rivers.org.nz/nz/wellington/hutt/hutt-river-mangaroa-to-twin-bridges","Wellington","Hutt","Mangaroa to Twin Bridges","II","2","","","0.5-1.5 hours","At Mangaroa Stream confluence, next to SH2","At Twin Bridges - confluence of Hutt and Akatarawa or Hutt Valley CC Clubrooms on banks of Hutt River","This section is described in the Twin Lakes section. Basically the put-in is half way through the normal ""Twin Lakes"" run. There are several easy rapids to negotiate, suitable for learners at normal flows. There are numerous willows along the edges."
"https://rivers.org.nz/nz/wellington/hutt/twin-bridges-to-poets-corner","Wellington","Hutt","Twin Bridges to Poet's Corner","II","2","7.5km","1.7m/km","1-2.5 hours","At the confluence of Hutt and Akatarawa Rivers (Twin Bridges) or at the Hutt Valley CC Clubrooms","At Poet's Corner across from Whakatikei Street next to SH2 (River Road) just north of the Moonshine Bridge","<p>Leaving the Twin Bridges you encounter a right hand bend with a left wall easily negotiated but can be troublesome for newbies at higher flows. Easy Class II down to overhead wire bridge then onto sharp right bend about 3km down. This is Maoribank Rapid and has several bedrock features and chutes to negotiate. This can be  Class III depending on flows. Can be portaged generally in a variety of ways. Another km down you pass beneath the Totara Park road bridge then there may be several small drops/waves before you pass the Whakatikei Stream confluence on river right (easily missed) then very soon you are at the take out (river left). This is a popular swimming spot so expect to see people and maybe even a dog or two.</p><p>Beware of willows and old riverworks. "
"https://rivers.org.nz/nz/west-coast/inangahua/inangahua","West Coast","Inangahua","Inangahua","III-IV","3.5","7km","18m/km","2-3 hours","At the road bridge on SH7, where there is a steeper rapid immediately above the road bridge","River flats on the right","The Inangahua flows east from Rahu Saddle to Reefton before it joins the Buller. After heavy rain this section offers something a little different!<p>The first rapid just above the road bridge doesn't really charecterise the rest of the run, which typically has more single drops with powerful hydraulics. The harder rapids are in the first kilometre, before easing to class III boulder gardens. At the flows necessary for this run to go, the water is brown and pushy, and you can hear boulders rolling along the river bed underneath your boat!</p><p>To get to the put-in; drive east from Reefton on SH7.  The road crosses the Inangahue several times, stop at the bridge with an obvious class IV rapid immediately upstream of the bridge. Put in here.</p><p>The take-out is harder to find. Return towards Reefton for about 6km. On the left there is a grassy flat where the gradient of the river has obviously eased. It is worthwhile marking the take-out with something visible from the river.</p>"
"https://rivers.org.nz/nz/taranaki/kaiauahi-stream/kaiauahi-stream","Taranaki","Kaiauahi Stream","Kaiauahi Stream","III+","3.25","","","","Hill Rd","SH3",""
"https://rivers.org.nz/nz/bay-of-plenty/kaituna/awesome-gorge","Bay of Plenty","Kaituna","Awesome Gorge","III","3","2km","","25 mins","below Trout Pool Falls","Sharp Left Hand Bend. Orange Spray Paint on River Right. Take out on the right. DO NOT MISS THIS TAKE OUT!","<p>There is an awesome gorge run on the lower Kaituna - surprisingly enough - called Awesome Gorge! It starts out from the Trout Pool falls as a meandering stream and then slowly picks up pace through a few class I-II rapids that give you a good taste of what is to come. The river backs off slightly at an open area that commercial sledgers use as a take out. Look for the tyre steps and the farm just past the pylons.  Beyond this it picks up pace as the gorge narrows. The corners get tighter and suddenly, like your sphincter, the gorge tightens right up and you're into a 300m section of continuous class III white water. There are no eddies. Once you exit the fast-paced section you round a couple more corners before Awesome Gorge Falls. This is a 3m blind drop - run it just off river left with a good boof over the hole at the bottom - hopefully.</p><p>About seven more corners of fast moving water and you are at the take out. Look for the bright orange paint. <em>You do not want to miss this</em>.</p>"
"https://rivers.org.nz/nz/bay-of-plenty/kaituna/gnarly-gorge","Bay of Plenty","Kaituna","Gnarly Gorge","V","5","","36m/km","","Bottom of Awesome Gorge run","","<p>Below Awesome Gorge take out you are immediately into the meat of Gnarly Gorge which is a continuation of Awesome Gorge style of paddling but much narrower, steeper and faster with hidden trees and more waterfalls. You <em>must</em> seek quality local beta before you try this one.</p><p>Paddlers have been regularly portaging the ""Gnarly Gorge"" section using the track on river right through the pine forest. It is about a 30 minute walk downstream to the next pool. Be aware the river right is all private land and it is up to the individual to get permission for access. River left for most of the length of ""Awesome and Gnarly"" is ""Scenic Reserve"" but there are very few tracks.</p>"
"https://rivers.org.nz/nz/bay-of-plenty/kaituna/okere-falls","Bay of Plenty","Kaituna","Okere Falls","III-IV","3.5","1.1km","36m/km","30-60min","control gates by the Kaituna River Bridge on SH33","last drop above Trout Pool Falls (don't miss it!)","<p>A long time classic in the Central North Island the Kaituna is famous for its waterfalls, park "
"https://rivers.org.nz/nz/bay-of-plenty/kaituna/smokey-falls","Bay of Plenty","Kaituna","Smokey Falls","III-IV+ (V)","3.725","24km","15m/km","5-6 hours","At end of Gnarly Gorge section","Maungarangi Road bridge","<p>Includes rapids Number 1, Number 2, Number 3, Smokey Falls, Happy Ending.</p><p>The last gorge below 'Smokey Falls' has been accessible for a number of years from the Ash farm on Maungarangi Road. this is a class II-III paddle out to the flat water.</p>"
"https://rivers.org.nz/nz/west-coast/kakapotahi/upper-kakapotahi","West Coast","K","Upper K","IV+-V","4.6","1.5km","10m/km","4-8 hours","Top gorge","Kakapotahi Road Bridge on SH6","<p>The spring floods of 2001 had much to answer for in the Kakapotahi. A large chunk of rock fell out of the wall into the tunnel rapid in the upper Kakapotahi and rendered it unrunnable. The river continued to be paddled by running right at the tunnel and portaging the choked off drop to below the tunnel. Who knows when the river will change again and be - well, all good?The beautiful upper Kakapotahi is a fantastic kayak run, one of those places kayaks were just made for. It has seven drops, all of which are difficult to scout and have some consequences for blowing the line. Finding someone with prior experience is a good idea, especially if the river is pushing the upper end of the flow limit. About twelve cumecs is optimal and it requires rain to get to this level. The two middle drops are the crux. Run Postman"
"https://rivers.org.nz/nz/west-coast/kakapotahi/mid-gorge-to-sh6","West Coast","K","Mid Gorge to SH6","IV (IV+)","4.02","9km","10m/km","4-8 hours","Mid Gorge","Kakapotahi Road Bridge on SH6","<p>The lower Kakapotahi has proven itself as a lasting run for intermediates and experts alike. Best with a good fresh of water but it can be paddled at most levels. After the class IV descent to the river there are some good class II rapids to warm up on before the river sidles into an innocuous looking gorge (aren"
"https://rivers.org.nz/nz/west-coast/karamea/venus-creek-to-gauge","West Coast","Karamea","Venus Creek to Gauge","III+ (IV)","3.3","52km","6.5m/km","2-3 days","Venus Creek","When the river opens onto farmland","<p>The Karamea is magic. Located in the heart of Kahurangi National Park, the huge surrounding valleys, limestone walls and enormous earthquake slips hint of powerful forces at work in the landscape, conjuring an aura hard to beat anywhere. The whitewater is fun, but don"
"https://rivers.org.nz/nz/west-coast/karangarua/upper-karangarua","West Coast","Karangarua","Upper Karangarua","V","5","","","","","",""
"https://rivers.org.nz/nz/otago/kawarau/dogleg","Otago","Kawarau","Dogleg","III+","3.25","7.5km","4m/km","1-3 hours","Rafters","Dog Leg camping area, Rafters Road","<p>Fun surfing, enders, splats, pivots, wave wheels and eddy line cartwheels at a variety of places, in a variety of flows on one of the biggest rivers in New Zealand. Summer flows may get as low as 100 cumecs, spring and flood flows may easily reach 600-700 cumecs. Whatever the flow there always seems to be something to do.</p><p>After the put in the gorge closes in around you and an ominous roar heralds your arrival at the top of Smith's Falls. Find a wave, or if your life insurance is up-to-date catch a ride in the <em>big</em> hole on the right side. Beware of plummeting bungy jumpers off the second of the Twin Bridges. Violence may ensue if you try to get out on their platform unless it's a dire emergency - exit here at your own peril.</p><p>The best surfing on Do Little Do Nothing is at about 165 cumecs, on the 3rd wave back where you can cross over to river right or recycle behind the rock on river left. The front wave is good at flows >300 but hard in short boats. A long stretch of canyon with excellent eddy lines leads into the final and crux rapid, Dog Leg. Out of control surfing in the first part of Dog Leg is not to be missed-but often is as the waves are fast and difficult to catch. Head left around the island and look for waves and a ledge hole on the left. The take out is on the right just beyond here and getting out here is a good idea as Nevis Bluff lies just a few kilometres downstream and there are no more take outs.</p><p>Camping at the take out is lovely, and there are some premium spots among the trees. At this stage it is free so let's look after it. We can keep it that way by cleaning up after ourselves and using the toilets provided. If you plan to stay a while and use an open fire please bring your own firewood. After two decades of use people have pruned, cut and savaged the resident trees to a seriously depleted state. New wineries have been sprouting all around the area so make sure you pay a visit or three.</p><p>To get to the put in: drive on SH6 between Queenstown and Cromwell. About 4km east of the Arrow River bridge is a gravel turning area with a road leading down to a carpark. A track leads to the river. Rafters clip their rafts onto a steep "
"https://rivers.org.nz/nz/otago/kawarau/nevis-bluff","Otago","Kawarau","Nevis Bluff","VI-","5.75","1km","25m/km","60 seconds (to the b","At the top of the rapid","Victoria Bridge on SH6","<p>This run is stupendous!! As a sure sign of the times and the speed of change in this sport Nevis used to be the pinnacle of NZ whitewater but has become a regular run for Queenstown locals and visiting hard people. It still continues to change and it is difficult to say whether it has become easier or not - it's still <em>big</em> and it's still impressive. Have fun and be safe.</p><p>Nevis Bluff came into existence when the Kawarau river carved its way around a particularly tough piece of bedrock. As people moved through the area early in the twentieth century the road was established and the bluff had to be dealt with. Blasting and road cutting saw huge amounts of rock tossed into the river creating the rapids we know and love as Nevis Bluff.</p><p>The rapids have a chequered history: in 1980 a young paddler from Nelson, Chris Moody, attempted the rapids in an old fibreglass kayak. This attempt might have been successful had his trusty old boat not broken up around him. He apparently swam the rapids and finished up with the cockpit coaming hanging like a hula hoop around his waist.<br />In the 1981 South Island Recreational River Survey, Graham Egarr noted: ""the rapids are unnavigable and exceedingly dangerous"". Then in 1983, US kayaking guru Rob Lessor made an attempt. Having seen the rapid and heard the rumours, he was dressed in two life jackets as he pushed into the current. He did, however, put in below the first drop, thus eliminating the first two moves. The rest of his run was successful.</p><p>In July 1984 the gates at the Kawarau Falls bridge were closed for an assessment of the recreational, visual, and environmental impacts of hydroelectric development involving lowering the Kawarau's flow. The flow was reported to be 40 cumecs (lower than any recorded natural flow). Greg Bell and Gordon Raynor paddled the whole rapid and Tony Marcinowski put in after the first drops. It is interesting to note that these paddlers, talented as they were, had chosen to prepare for the run in the fashion popular at the time which was probably attributable to their success:</p><p>	""Probably a kind of sixth sense telling me I was in a strange location bade me regain consciousness. A primeval survival instinct prevented me from yet opening my eyes. I was too frightened to move lest I disturbed the timpanist in my brain. My mouth felt like a small creature of the night had used it first as a latrine then as a mausoleum. Slowly, I opened my eyes; a big white thing stared down at me; I'd seen one before, but not from this angle. Over a bit further I spied a shower cabinet and some toothbrushes. Terrific - I had spent the night in the bathroom. Slowly, I arose and made my way to the lounge. I extricated my watch from a cup of cold tea - it was still early. The next thing I heard sounded very much like a bellowing hippo ""C'mon-let's go paddling""....."" - NZ Canoe, Rafting magazine No.31, 1984</p><p>"
"https://rivers.org.nz/nz/otago/kawarau/roaring-meg","Otago","Kawarau","Roaring Meg","III","3","5km","5m/km","1-3 hours","Carpark 800m upstream of the Roaring Meg Power Station","The secret roadside area 5.2 km along the road","<p>If boils and whirlies make your heart go pitter patter then get your teeth into this one. A fun run at any level with good surfing at regular intervals and locals have a regular Tuesday evening descent (6pm) throughout the summer months if you need to meet people or find a girlfriend/boyfriend.</p><p>At flows upto 200 cumecs there is a user friendly playhole at the put in. After the slalom site the whirlpools spiral down the gorge through a number of unnamed rapids. The only one of note is halfway down the run - a large hydraulic named Man Eater. I have seen proof, however, that this hydraulic is non gender specific. Around 170 cumecs it can only be run hard right. Between 170-250 it is <em>huge</em> crashing wave and can be surfed if you have what it takes. From here down enjoy the scenery and the endless seams to bury your tail in.</p><p>Take some time to reflect that this slackening water which now runs into a lake once flowed on to the famous Sargood's Weir. Sargood's Weir was one of the biggest, best rapids in the country. There were not many solid class V <em>big</em> rapids (200-500 cumecs) in the world. We had one of them. It exuded power, technicality and lack of emotion. Paradoxically it demanded of its suitors awe, fear, but most of all respect. It remained unpaddled until 1980 when Mick Hopkinson, then on holiday from the UK, paddling a fibreglass slalom boat successfully ran the rapids. Rob Lessor from the USA claimed the second descent in 1983. Then in 1984 Mick Hopkinson with partner in crime, Dirk Passchier, returned again. Dirk claimed the first 'Kiwi' descent of Sargood's. Through the late 1980s it became 'the rapid' for any aspiring hardperson and saw a number of descents. The intensity of use increased when the plans were published which showed that the lake from the Clyde Dam was going to flood the area to immediately above Sargood's Weir. People were keen to paddle the rapid before it died. When it finally drowned a slow and lingering death in 1992, Mick, who had paddled the rapid eighteen times, mourned its passing like a lost friend - indeed it was. May this murder of an international resource never be allowed to happen again.</p><p>To get to the put in: find the Roaring Meg Power Station on SH6. the put in is 800m towards Queenstown down a gravel road which descends a short distance to a large gravel carpark. A track leads to a gap in the gorge walls and the short clamber down to the river.</p><p>To get to the take out: from the power station drive about 4.5km down SH6 to a gravel road on the right cutting back down to a gravel parking area. There are some grey road marker posts numbered along this side of the road. The road is just after the 39 marker. If it is your first time on the run go down to the river so you can identify the exit point when you get there.<br />Class III+: >350 cumecs</p>"
"https://rivers.org.nz/nz/otago/kawarau/citro%C3%ABn","Otago","Kawarau","Citro","IV","4","3km","10m/km","1 hour","Gravel road, 2km east of Victoria Bridge.","3km down the road at another gravel track to the river.","<p>Now the scene of much hooting and hollering as aspiring hardpeople cut their teeth on their first class IV+ big water, the Citro"
"https://rivers.org.nz/nz/otago/kawarau/sargoods-weir","Otago","Kawarau","Sargood's Weir","V","5","","","","","","<p>There were not many solid Class V BIG rapids (200-500 cumecs) in the world.  We had one of them.  It exuded power, technicality and lack of emotion. Paradoxically it demanded of its suitors awe, fear, but most of all, respect. It remained unpaddled until 1980 when Mick Hopkinson, then on holiday from the UK, paddling a fibreglass slalom boat successfully ran the rapids.  Rob Lessor from the USA claimed the second descent in 1983. Then in 1984, with partner in crime Dirk Passchier, returned again. Dirk claimed the first 'Kiwi' descent of Sargood's.  Throughout the late 1980's it became 'the rapid' for any aspiring hardperson and saw a number of decents. The intensity of use increased when the plans were published which showed that the lake froim the Clyde Dam was going to flood the area to immediately above Sargood's Weir. People were keen to paddle the rapid before it died. When it finally drowned a slow and lingering death in 1992, Mick, who had paddled the rapid eighteen times, mourned its passing like a lost friend - indeed it was.</p><p>May this murder of such an international resource never be allowed to happen again.</p>"
"https://rivers.org.nz/nz/otago/kawarau/kawarau-falls","Otago","Kawarau","Kawarau Falls","I-II","1.5","","","","","","From lake, under road bridge, to ?. Watch out for weirs beneath bridge at Kawarau Falls."
"https://rivers.org.nz/nz/northland/kerikeri/kerikeri","Northland","Kerikeri","Kerikeri","I","1","","","","","","<p>RUS 1112</p>"
"https://rivers.org.nz/nz/taranaki/kiri/kiri-river","Taranaki","Kiri","Kiri River","IV+","4.25","","","","Carrington Rd","Kirihau Bridge",""
"https://rivers.org.nz/nz/west-coast/kokatahi/crawford-junction-to-bridge","West Coast","Kokatahi","Crawford Junction to bridge","IV-V (VI-)","4.55","13km","2m/km","6-8 hours","Crawford Junction","Bridge at the pick-up point","<p>Since 1996, when Bruce Barnes and I did the first descent and both nearly died in Carnage Gorge, this river has kicked more guru ass than the spotted guru ass-kicker from planet Kick Ass. Hence its reputation as a tough run. <strong>BUT</strong> - in the manner of changing nature, debris movement in the Kokatahi seems to have mellowed it a lot since its heyday! That probably means only one thing "
