"Id","Region","River Name","Section","Class","Class (decimal)","Length","Gradient","Time","Put in","Take out","Body"
"https://rivers.org.nz/nz/canterbury/okuku/lees-valley-to-whiterocks","Canterbury","","Lees Valley to Whiterocks","IV-IV+","4.1","26.5km","10m/km","4 hours","Lees Valley via Okuku Pass road or Lees Valley road","Taaffes Glen road (Whiterock Downs farm)","<p>The Okuku River is one of the best technical class IV runs in Canterbury.  Similar in character to the Upper Waiau and Ashley rivers, the Okuku only flows in extended periods of SE rain in Canterbury, the heart of winter, or during snow melt in August/September.  Despite the usually low temperatures, and the need for a 4WD vehicle plus driver, the Okuku is well worth the effort.  A scenic run with several nice gorge rapids, the river builds up to where the south branch joins in to produce an excellent last 7.4 km stretch which drops at 13.5 m/km and contains several class IV - V rapids depending upon river flow on the day.</p><p>Soon after the start from the Okuku Pass road put in is a nice class III rapid which gives the paddlers an indication of what lies ahead.  The next 8 km is a mixture of class II/III rapids with some good play spots.  The river is reasonably flat and wide at this point, and paddlers should encounter a stock fence that runs across the river.  Be wary because in high flows the fence can be difficult to see "
"https://rivers.org.nz/nz/west-coast/oparara/top-bridge-to-quarry","West Coast","","Top Oparara Road Bridge to Quarry","IV-V","4.5","12km","28m/km","4.5-8 hours","Top bridge over the Oparara River","Past the quarry sit, 4 kilometres up Oparara Road.","<p>The Oparara is a river fit for inclusion in Lord of the Rings. Weird runes in the water, limestone sculptures dripping from the over hanging roofs of caves, mosses and vines damp and hanging in the misty forest densely packed alongside the river. The river trip had been similarly shrouded in mystery after early reports and attempts gave rise to stories of bush bashing, boats used as bridges to cross fissures, paddles lost in sinkholes and trolls living in the bottom of drops.</p><p>Five years passed between my first and second trips. I was anxious that perhaps I had seen it wrong. Alas - it remains as it was. A great day out, still adventure kayaking and totally worthy as long as you take pleasure in the overhanging caverns and arches, phenomenal rainforest, bizarre tea coloured water and the fantastic bedrock shapes through the run. Oh and there is some good white water in there and quite a bit in the last section. Expect a gradient of 12m/km to Fenian Creek and 28m/km from Fenian Creek to the take out.</p><p>The Oparara was first run in March 1993 in a standard summer flow. The team reported a scratchy but interesting trip. Other parties established the flow parameters through the 95/96 season. The river needs rain, but like many things in life, moderation is the key - including moderation. At the top bridge over the Oparara, look underneath at the concrete footings. If the water is lapping at the bottom edge of the concrete this is about optimal flow. The tolerance seems to be about 20 centimetres either way from there. Much higher or lower and you may be doing more tramping than you bargained.</p><p>Since 1998 the bottom section has become the standard. Walk up to Fenian Creek from the take out and you can go with quite a lot more water than you"
"https://rivers.org.nz/nz/bay-of-plenty/opato-stream/manganuku-to-near-wairata","Bay of Plenty","Opato Stream","Manganuku to near Wairata","II-III+ (IV)","2.7","4.5km","14.5m/km","1-2 hours","Manganuku campsite","At the monument","<p>Opato River</p><p>To get to the put in: From the settlement of Matawai drive 24km through<br />the Waioeka Gorge towards Opotiki, watch out for the Manganuku campsite, put in<br />below the bridge.</p><p>To get to the take out: Drive a further 4.5km to a monument on the left<br />side of the road. From Opotiki drive towards Gisborne, the monument is 2km past<br />the small settlement of Wairata.</p>"
"https://rivers.org.nz/nz/canterbury/opihi/opihi-gorge","Canterbury","","","III","3","","","","","",""
"https://rivers.org.nz/nz/wellington/otaki/otaki-gorge","Wellington","","","II-II+","2.15","","","","","","<p>A fun section close to Wellington.</p>"
"https://rivers.org.nz/nz/wellington/otaki/waitawaewae-hut-to-otaki-forks","Wellington","","Waitawaewae Hut to ","III-IV","3.5","","","","","",""
"https://rivers.org.nz/nz/west-coast/otoko/otoko","West Coast","","","IV","4","","","","","",""
"https://rivers.org.nz/nz/wanganui/papamanuka/papamanuka","Wanganui","Papamanuka","Papamanuka","III-IV","3.5","","","","","",""
"https://rivers.org.nz/nz/tasman/parapara/richmond-flat-to","Tasman","Parapara","Richmond Flat to ?","IV","4","15km","50m/km","4 hours","Richmond Flat","Road end","<p>The Para Para has a four kilometre trip in a beautiful gorge and you can fly. This little class IV number needs water (8 - 15cumecs) but has the normal Golden Bay fare of plenty of three metre falls into clean pools with portages around log jams and rock sieves. It even has the normal gradient of 50m/km. </p><p>The first 500m is class I to an old dam. Portage this on the right and the first drop/logjam on the left. After a few bedrock type drops the river changes into steep technical rockgarden rapids. There are a few short portages interspersed with classic drops with plenty of air. Towards the end is a long steep section with a three metre waterfall. Just after this is the last short gorge with a complex drop. Portage by jumping onto the centre rock then launching. The other option is to portage over the cliffs (1/2 hour). The rapids continue to the road end. Take out here or continue to the estuary and the main road.</p><p>From Takaka drive to the Parapara bridge. Wait for the helicopter. If you drive up the river left side to where the road joins the river you will get an idea of the flow unaffected by the estuary. Drive another couple of kilometres on the main road until Plain Rd. Turn left on Plain Rd and drive 3km to a road junction. Turn left and drive through a gate (there is a phone number to call before crossing the land). Follow this road down past two gates and stop at the hay shed if you don"
"https://rivers.org.nz/nz/tasman/pearse/upper-pearse","Tasman","Pearse","Upper Pearse","IV-IV+","4.1","0km","0m/km","1-3 hours","Walk in from the Pearse Valley road end.","At the road end, or in higher flows down to the waterfall.","<p>The Pearse offers a bit of steep close to Nelson. With a bit of a fresh, the top gorge goes and is a short but very tight gorge with some fun small drops and steep short rapids. At higher flows the gorge can be quite intimidating, but the lower stretch of the river offers some fun III+ for more intermediate paddlers, or makes it a good length river trip if doing both sections.</p><p>From the put in, the top gorge goes straight into steepish boulder gardens. There are small pools between the rapids. There is potentially one portage at the end of the top gorge at lower flows. The portage is heralded by a difficult to boat-scout drop on river left. At most flows it can be scouted by clambering on rocks at the right. From here make your choice. If you are not paddling the drop, launch in on river right and skirt the sieve-y drop to boof off a small gap in the rocks. After a flat bit, the top section ends with three quick and fun short rapids/drops just before the road end.</p><p>If there is a good amount of water at the road end, the lower section is well worth doing.  It has even-gradient rapids for the most, apart from a drop in the middle that may require scouting and a waterfall at then end. The bottom waterfall can be paddled at very high flows, or otherwise use the rock-slide on river left.</p><p>The Pearse traps timber, so tread carefully. The top gorge will be a mighty handful at very high flows and will be continuous, hard to scout and dangerous. Although short, it can be very difficult to get out of.</p><p>To get to the put-in; from the Motueka River West Bank Road turn onto the Pearse Valley Road.  Drive to the end.  This road is usually negotiable with a two wheel drive, but on occasions can become too rutted or muddy and you may have to walk further. At the road end, cross the river and hike up an excellent track. Ignore the longish section of flat water - it gets better at the top. After 30 minutes you will get to the high-point in the track with a bench built into a small cave in the rock face. From here, walk five more minutes and bash down the second tiny creek you cross to the river.</p><p>To get to the take-out; depending on flows, the takeout is at the road end, or if enough to do the lower section the recommended take out is at the waterfall next to a large tree with parking spot - about three kilometres from the road end or half way down the road.</p>"
"https://rivers.org.nz/nz/west-coast/perth/upper-perth","West Coast","Perth","Upper Perth","V-V+","5.2","13km","50m/km","1-2 days","Above Scone Hut","Old road SH6 bridge on Whataroa River.","<p>If you want more hardcore action take your over night gear, get that dropped at Scone Hut and get flown 2-3 kilometres upstream to the edge of the Wilderness area (helo not allowed beyond this) </p><p>From here down it is steep, low volume creeking class IV-V with a couple of crux class V"
"https://rivers.org.nz/nz/west-coast/perth/five-finger-stream-to-old-sh6-bridge-site","West Coast","Perth","Five Finger Stream to old SH6 bridge site","IV","4","","18m/km","","Five Finger Stream","Old SH6 bridge site","<p>The scenery is stunning, the water is blue and the paddling totally absorbing. The lower section from Five Finger Stream has also become one of the established intermediate runs on the Coast.</p><p>Relax into class III+ water for a few kilometres past Nolan"
"https://rivers.org.nz/nz/west-coast/perth/scone-hut-to-below-five-finger-stream","West Coast","Perth","Scone Hut to old SH6 Bridge Site","V","5","13km","40m/km","4-6 hours","Scone Hut","Old road SH6 bridge on Whataroa River.","<p>Outrageous is the only word to describe the first few kilometres of the Perth River. It has become one of the "
"https://rivers.org.nz/upper_pohangina","Manawatu","Pohangina","Upper Pohangina","IV","4","","","","","","<p><a href=""http://nzkayaking.cabspace.com/gallery.html#videogallery"" title=""http://nzkayaking.cabspace.com/gallery.html#videogallery"">http://nzkayaking.cabspace.com/gallery.html#videogallery</a></p>"
"https://rivers.org.nz/nz/waikato/pokaiwhenua/pokaiwhenua","Waikato","Pokaiwhenua","Pokaiwhenua","II (IV)","2.22","2km","","10 min - 1 hour","","",""
"https://rivers.org.nz/nz/waikato/poutu-stream/poutu-stream","Waikato","Poutu Stream","Poutu Stream","IV","4","","","1 hour","Poutu Falls (off SH 1, opposite the get out for section 10)","Pouto Falls","<p>Conditions from the lake outlet to Poutu Falls are reported as very grovelly. Poutu Falls is a clean 10 metre drop into a plunge pool - definately worth the 20 minute walk in. The stream enters a nasty technical gorge below the falls with  lots of trapped wood. Arguable whether the invested energy portaging is worth your fun, people have hiked out before.<br />To get to the falls. Park at a small clearing on SH1 (opposite the get out for the Tongariro access 10 section. Car theft is a big issue so perhaps camouflage your car with some bush (the exotic kind) or leave someone behind.<br />Follow the overgrown track going into the forest (used to be 4WD)  until you get to a gravel road. Follow this road to the left for about 15 minutes until you hear the falls (it really is pretty obvious). There are some bushwacked tracks on the left going into the bush and down the gorge. Once you find yourself at the pool at the base of the falls skirt around the bush (or paddle) to the right. There's a well used track leading up to the top.</p>"
"https://rivers.org.nz/nz/canterbury/pukaki/below-sh8","Canterbury","Pukaki","Below SH8","II","2","","","","Carpark on true left below control gate on SH8","Approx. 3.3km further along sideroad where road drops close to river","<p>The Pukaki river drains Lake Pukaki into Lake Benmore but now only flows a few times each year according to a schedule negotiated with Meridian Energy under consent CRC905321.7 as part of the massive Waitaki hydro scheme. The run is typically short, fast and furious with occasional one-shot waves in a wide river bed. Easy access means you can do multiple runs so it's a good opportunity to trial some different kayaks.</p><p>Many people choose to put in below the initial river-wide weir of boulders at the end of the pool below the spillway. This has been the scene of an entrapment in the past.</p><p>Road to takeout is rough, will suit vehicles with decent ground clearance.</p>"
"https://rivers.org.nz/nz/marlborough/rai/to-pelorus","Marlborough","Rai","To Pelorus","I-II","1.5","","","","","","NZ South Island Rivers, Egarr, p143-144 mentions Chicken Run rock garden, Rai Falls (class II), The Washing Machine."
"https://rivers.org.nz/nz/canterbury/rakaia/rakaia-gorge","Canterbury","R","R","II","2","","","","","",""
"https://rivers.org.nz/nz/bay-of-plenty/rangitaiki/aniwhenua-run","Bay of Plenty","Rangitaik","Aniwhenua Run","II","2","8km","3m/km","3-4 hours","below Aniwhenua Falls, or paddle the Falls","where the road first returns to the river, 7km from the Aniwhenua Power Station turnoff","<p>This section of the Rangitaiki below Aniwhenua is a great novice section and one of the favourites in the region. It has been kept alive by river users and environmental groups who banded together in 1995 to fight a proposal by Bay Of Plenty Electricity to dam the river to the base of the falls. When dam is releasing it is possible to paddle from the base of the dam down to the falls.<br />Aniwhenua Falls makes for an exciting put in and kayakers have been plummeting off the edge for years. Things have changed a little after recent floods and there is a ledge you can hit when there is 2.5 cumecs or less running over the falls. Otherwise take lots of pictures and enjoy this kindergarten huck.<br />Below Aniwhenua the river flows between fantastic walls of ancient volcanic ash. The water is mostly class I-II and when flows are good the rocks are well covered producing great little waves for aspiring surf hogs and there are plenty of pools and eddies making this a popular teaching run.<br />To get to the put in: from the township of Murupara head east 2km to the turnoff signposted Whakatane, Te Teko, Kouriki. Follow this road for 3.5km to another junction. Turn left and follow Galatea Road for just over 20km. Turn left at a road sign posted Aniwhenua Power Station, cross the dam and turn right. Follow the road to its end by the Power Station just below the falls.<br />To get to the take out: drive back to Galatea Rd and turn left. Follow this road for about 9km. There is a jet boat launching ramp at Mangamako Stm that has off road parking and is probably safer than the "
"https://rivers.org.nz/nz/bay-of-plenty/rangitaiki/jeffs-joy-run","Bay of Plenty","Rangitaik","Jeff's Joy Run","IV","4","11.5km","9m/km","2.5-5 hours","end of the access road","at the rafting finish area","<p>The Rangitaiki is a great run for paddlers looking to cut their teeth (not literally) on lots of class III water with the added bonus of one class IV drop. It has lasted the ravages of time and while many people have moved on it is still where many North Island paddlers run their first class IV rapid. Besides, the run has lovely scenery and plenty of continuous class II-III action.</p><p>	Having diced with high speed logging truck death and possibly got lost on the drive to the put in (don't blame me) unwind through the first 200m of flatwater to the top of the old slalom site - scene of NZ's world cup slalom event in 1991. The first of the rapids take you past Rock A (avoid this one as it has killed people before) and Rock B (feel free to find a Rock C) then eases briefly before Fantail Falls and Jeffs Joy. These can be inspected by exiting on the right and groveling down amongst the toetoe (native grass known for slicing you to shreds) to the viewing platform.</p><p>	Things happen quickly once you drop down the steep ramp of Fantail Falls. Make what ever eddies you can but don't expect to fit a crowd in them. The final plunge over Jeff's Joy is a high speed rush and a rock wall will pass by in a blur, or you'll be upside down and not see a thing.</p><p>	Jeff's Joy was named after Jeff, surprisingly enough, whose surname has eluded me for years. Jeff was a tyre-tuber of great repute who worked in the forest around Murupara. He accompanied one of the first trips down the river in the early 1970's. Apparently he tubed the top section and by the time he got to the final drop (now named after him) he was unconscious from the beating he took on the way. His mates duly revived him and he lived to tell the tale and have a rapid named after him. Good on ya mate.</p><p>	The big pool below Jeff's is a good place to regroup and collect any gear and repair any damaged egoes. From here it is a kilometre of class II-III to the "
"https://rivers.org.nz/motutua_rapids","Bay of Plenty","Rangitaiki","Motutua Rapids","IV","4","","","","","","<p>The river starts with a narrow but fairly easy rapid under the bridge and opens out for a km or 2. The river is wide, shallow and swift over a shelf-like bedrock bottom but starts to steepen and narrow as it goes over a couple of smallish drops. It stays pretty narrow after this (portaging and inspection is difficult and sometimes painful due to the dense vegetation and the gorge - however, inspection is pretty important in places).<br />Just after the last rapid I described, there was a logjam which we had to portage. Not too difficult. Not far below this, the river went into a very narrow channel (2m wide) which lasted about 200-300m. The rapid was relatively easy - maybe grade 3, but committing and with logjam potential - inspectable. Below here, there may have been another narrow rapid before widening briefly. Following this was another very long, narrow, fast hydroslide style rapid which, due to high banks and dense vegetation was not really portageable or scoutable - we took a risk and paddled it blind. As it happened, there were no logjams and it was a nice long narrow grade 3+ rollercoaster (perhaps 4 because of degree of commitment) rapid. After this, the river slowed behind the intake dam which is the get out. There is a risk of logjams anywhere on this section of river, and in places, they could be very hard to avoid. It is a unique and fun section.<br />Map series 260 (1:50,000) Map No V18. Get in is on Ngapuketurua Rd Bridge and get out is at the Rangitaikie canal intake. Turn off Ngapuketurua Rd left into Kiorenui Rd and then left again when you hit the canal to get to the take out.</p>"
"https://rivers.org.nz/nz/canterbury/rangitata/rangitata-gorge","Canterbury","Rangitata","Rangitata Gorge","IV-IV+","4.1","10km","3.5m/km","1.5-3 hours","Down track to river where road first returns to the river (Whiterock Station)","River right just above the Klondyke intake","<p>The Rangitata Gorge has a long history as a Canterbury test piece. Like most NZ rivers things have changed over the years and the legendary hydraulics that used to devour fibreglass and UCCC paddlers more eagerly than a kid with a McDonald burger have changed, gone or been replaced. Higher skill levels and better kayak designs now make the Gorge a fun outing and attainable for strong intermediates.</p><p>Like many Canterbury rivers the upper section meanders in braids as the river twists its way out of the Alps towards the sea. If there"
"https://rivers.org.nz/node/545","Canterbury","Rangitata","Lower Rangitata","II","2","16km","","4 hours","Waikari Hills Station, or the take-out for the Rangitata gorge ie across the river from the Rangitata Diversion Race Intake.","Lynn Stream","<p>Alternate put-in is Irrigation intake at Klondyke but this makes for a long shuttle unless you are continuing to Arundel bridge. Alternate take-out is the Outdoor Pursuit Centre at Peel Forest.</p>"
"https://rivers.org.nz/nz/canterbury/rangitata/lynn-stream-to-arundel-bridge","Canterbury","Rangitata","Lynn Stream to Arundel Bridge","II","2","","","","","","Used by multisporters. A long trip from Klondyke."
"https://rivers.org.nz/nz/wanganui/rangitikei/matawhero-bridge-to-river-valley-lodge","Wanganui","Rangit","Matawhero Bridge to River Valley Lodge","IV","4","10km","11m/km","2-4 hours","off Matawhero Road where it joins the river","River Valley Lodge","<p>If there was one single river with every ingredient for the evolutionary recipe of trip into epic into story into legend, it is the Rangitikei or 'day of striding out'. Take one reasonably accessible yet wild river flowing through a spectacular, deep gorge. Add several challenging drops and one extremely cool play hole. Attach a large catchment that causes the river to rise and fall dramatically in short periods of time. Put a lodge, hot showers, a big open fireplace and a bar at the take-out. Job's on.</p><p>The Rangitikei is a classic that has been paddled for years by scores of kayakers, though its early paddling history was filled with the carnage of fibreglass boats. The first explorer to the gorge was Cliff Barnett who, in 1953, attempted the run in an open canoe. It wasn't until the early 1960s that two men from Palmerston North entered the gorge in a home-made, stainless steel canoe. It took them two seasons to get right through! The first complete kayak descent was in May 1974 by Max Grant (of 'Max's Drop'), Peter Sutcliffe and Dennis Oppatt.</p><p>The first six kilometres on the river is an excellent class III warm up for the harder stuff to follow. Pop Up is a fun little play spot guaranteed for loops and cartwheels. The first real water is a short drop, called Storm, which runs through a small gorge and into a wall at the bottom. This is followed by more easy water through the very obvious Narrows to the Lunch Spot, named because it is in fact a lunch spot, not a rapid.</p><p>Technical and bony in low flows, still technical and pushy in high flows, the gorge rapids proper follow in quick succession. New Rapid is constantly changing and is well worth scouting because it hides a couple of nasty pin spots. Then come The Gates, Slip Rapid, Max's Drop, Dog Leg, Fulcrum, Etc, Foamy, Foo Fang Falls, See Thru, Picket, Rodeo, Rockslide, Waimarino, Cascade Creek, Toi Toi Creek and Slalom Rapid right outside the Lodge. Of these Fulcrum and Foamy offer the crux of the paddling. There is a compulsory test at the end of the run to check if you have all the names right and in the right order!</p><p>If it's your first time down you'll probably want to scout some rapids as the line is not always obvious. More experienced paddlers should be able to boat-scout everything. Check in with Brian and Nicola Megaw at River Valley Lodge before you go on the river. They have been running the Lodge and rafting the river since 1986 and are tuned into changes of rocks, trees and water levels in the river. This is not a good run to choose as your first class IV outing! Don't be misled by the average gradient. Most of the drop is in the last 1.5km.</p><p>Above 50cu the rapids become very pushy, and time to correct any mistakes is reduced markedly. The river has been run at very high levels (>50cu) and makes for a great expert trip.</p><p>The Megaws, Sages and River Valley Lodge staff are very hospitable. They will drive a shuttle if arranged in advance. This saves the hour-long return trip to pick up cars when you could be sitting outside the Lodge with a beer or two. The Lodge offers camping, accommodation, golf, food and the all important bar.</p><p>River levels are best obtained on-line at <a href=""http://horizons.govt.nz/"" title=""http://horizons.govt.nz/"">http://horizons.govt.nz/</a> and the conversions are done by the nice folks at River Valley <a href=""http://rivervalley.co.nz"" title=""http://rivervalley.co.nz"">http://rivervalley.co.nz</a> While it isn't updated daily, it changes whenever the flow changes. If not online, call 06 388 1444.</p><p>To get to the take-out: From Taihape follow the signs to River Valley along Wainui Road and Otuarei Road. If coming from the north drive 18.1km from the southern end of the Army Training Camp at Waiouru to a turn-off signposted to Moawhango, Napier and River Valley. Follow this sealed road for 9.5km to another junction, turn left and keep following signs 23km to Pukeokahu and River Valley.</p><p>To get to the put-in: from the entrance of the River Valley farm road drive 13.5km east on the gravel road to a grassy flat where the road meets the river.</p><p>Catchment:<br />Egarr_Comments: ""high quality trip<br />Egarr_Code: 49.02<br />Egarr_Vol: NI<br />Egarr_Page: 50<br />Egarr_Rec: 5<br />Egarr_Scen: 5<br />RUS_Code: 1428</p>"
"https://rivers.org.nz/nz/wanganui/rangitikei/river-valley-lodge-to-tarata","Wanganui","Rangit","River Valley Lodge to Tarata","I-II","1.5","","","","","",""
"https://rivers.org.nz/nz/wanganui/rangitikei/above-matawhero-bridge","Wanganui","Rangit","Above Matawhero Bridge","I","1","","","","","","<p>RUS 1423, class unknown</p>"
"https://rivers.org.nz/nz/wanganui/rangitikei/pukeokahu-to-utiku","Wanganui","Rangit","Pukeokahu to Utiku","I","1","","","","","","<p>RUS 1429</p>"
"https://rivers.org.nz/nz/wanganui/rangitikei/utiku-to-mangaweka","Wanganui","Rangit","Utiku to Mangaweka","II","2","","","2-3 hours","","Mangaweka Camp Ground","<p>RUS 1430, class unknown</p>"
