"Id","Region","River Name","Section","Class","Class (decimal)","Length","Gradient","Time","Put in","Take out","Body"
"https://rivers.org.nz/nz/canterbury/acheron/chimney-stream-to-clarence","Canterbury","Acheron","Chimney Stream to Clarence","I-II+","1.6","10km","","2-6 hours","","Just below the Clarence confluence.","<p>The Acheron lies in the wide open spaces of inland Marlborough and with road access for all its length it's a good paddle for those who like scenery with their paddling. Most of the river is easy single channel with a few corners, but there are a number of bedrock rapids which require class II and III skills to negotiate. The river is best with flows in the 20-50 cumecs flow range, but it is still a scenic float plus bony rapids run at 15-20 cumecs.</p><p>The put in can suit your timetable, but about 25km upriver the river is braided Class I and mostly of interest for bird watchers and fishers. The access is via the Molesworth road via Hanmer Springs and Jacks Pass and access details are available on DoC website. Generally you can get on this road between Christmas and early April, but kayakers can ask DoC Marlborough or DoC Waimakariri for access. The road is OK for cars with reasonable ground clearance.</p>"
"https://rivers.org.nz/nz/west-coast/adams/to-wanganui","West Coast","Adams","To Wanganui","V","5","","","","","",""
"https://rivers.org.nz/nz/west-coast/ahaura/waikiti-to-ahaura","West Coast","Ahaura","Waikiti to Ahaura","II","2","","","","On Waikiti river","","<p>Put-in on Waikiti River at bridge<br /><a href=""http://www.topomap.co.nz/NZTopoMap?v=2&ll=-42.567549,171.886662&z=14&pin=1"" title=""http://www.topomap.co.nz/NZTopoMap?v=2&ll=-42.567549,171.886662&z=14&pin=1"">http://www.topomap.co.nz/NZTopoMap?v=2&ll=-42.567549,171.886662&z=14&pin=1</a><br />Paddle braids into gorge.</p><p>Camp overnight on river flats in gorge. After gorge, braids return.</p><p>Take-out at Ahaura<br /><a href=""http://www.topomap.co.nz/NZTopoMap?v=2&ll=-42.350671,171.537418&z=14&pin=1"" title=""http://www.topomap.co.nz/NZTopoMap?v=2&ll=-42.350671,171.537418&z=14&pin=1"">http://www.topomap.co.nz/NZTopoMap?v=2&ll=-42.350671,171.537418&z=14&pin=1</a></p>"
"https://rivers.org.nz/nz/otago/ahuriri/ahuriri-drop","Otago","Ahuriri","Ahuriri Drop","II","2","","","","","",""
"https://rivers.org.nz/nz/wellington/akatarawa/akatarawa-karapoti-to-hutt-river","Wellington","Akatarawa","Karapoti to Hutt River","II+","2.25","4.4km","9m/km","1-2 hours","At first bridge on Karapoti Rd, off Akatarawa Road","At Hutt River confluence just off Akatarawa Road","<p>The Akas run is well-known by Wellington kayakers as the run you do if the Hutt Gorge is too high or if you are not yet ready to tackle the Gorge. Many a budding kayaker has cut their teeth as it were on the Akas on weekend mornings and/or after work in the evenings.</p><p>Being only 10 minutes from Hutt Valley Canoe Club clubrooms this is the local learners trip. However it does need some rain to make it fun.</p><p>Starting at the first bridge at Karapoti, the river leads down to a small drop which can provide some playing at good flows. 2 km of easy rock gardens brings you to another small wave with an excellent eddy where new paddlers can learn to surf at the right flows.</p><p>Another 1.5 km of easy rock gardens culminates in a steeper rapid after a left hand bend which has 2 routes. The right hand route has most water at lower flows but has some rocks to avoid as you drop down. A right hand bend follows as you head down to the Wall Rapid.</p><p>The Wall rapid is easy grade III  but can be intimidating to new paddlers. Run it on the right or paddle to the left and portage over a few rocks.</p><p>Another 1.5km and you are at the confluence with the Hutt River. If you left your car here paddle across the Hutt and take out. Otherwise carry on for another 2 or so km to the Hutt Valley Canoe Club and exit up the steps.</p><p>At high flows the Akas washes out and is a fast 0.5 hour run with few waves but plenty of swirly stuff and 1-2 holes. At high flows swimmers will take a while to make the banks and boat rescue can be tricky as the eddies wash out.</p><p>"
"https://rivers.org.nz/nz/tasman/anatoki/anatoki-hut-to-anatoki-valley-sawmill","Tasman","Anatoki","Anatoki Hut to Anatoki Valley sawmill","IV-V","4.5","15km","80m/km","14 hrs","Anatoki Hut or gravel beach","Anatoki Valley sawmill","<p>First run in December 1996 by a team from Nelson this creek can only be described as 'radical' and is the flag bearer for the Golden Bay runs and 8 cumecs is all that is required to make it a goer. If you haven't done the Anatoki you haven't done anything and if you go in prepared for anything - you will find it. If you are feeling lucky you could go without some food and overnight gear in your boat but most will want this as insurance - oh and don't expect any nice campsites if you do spend the night in there.<br />""A mix of mank and absolute classic drops but you have to work pretty hard for it all"" says Trent Garnham who managed a 2006 lightning fast run in 10hours with a very strong team! The Anatoki in good flow is just ten cumecs. The first 500m is flat and provides a chance for a warm up - yeah right!<br />The action comes at you for the next couple of hours in the form of some multiple drops and slides with small pools between. The section ends with a 5m waterfall and a small lake behind a slip. Just when you thought it was steep enough it gets steeper as the next 7km drops at 80m/km. This section is essentially a long and very steep rock garden and most things will need to be scouted.<br />Travelling at speeds of less than 1km/ hour is common but the portages are short and not difficult. Approximately two kilometres above Anatoki Bend are two nice, four metre waterfalls, the first can be portaged but the second is a clean drop into a big pool and can't be portaged. Shortly after this is a gravel beach which has okay camping for a multi day trip or provides a landing zone and starting point for a one day.<br />To get to the take out; from Takaka drive towards nelson for 2km. Turn right onto Anatoki Valley rd and drive approximately 5km, passing Bencarri Farm Park. Either park and fly from the old sawmill (you must ask the farmers permission to land the helicopter and cross his land) or further up the valley where the river meets the road before Happy Sam's Farm.</p>"
"https://rivers.org.nz/nz/tasman/aorere/fifteen-mile-creek-to-james-road-bridge","Tasman","Aorere","Fifteen Mile Creek to James Road bridge","II (III)","2.2","9km","","","15 mile creek, or if that seems a bit infested then Salisbury Creek bridge","James Rd Bridge","<p>A bit like Doctor's Creek on the Buller, only more beautiful, and with 1 slightly harder bit. The harder rapid that gets towards grade 3 at times is at the end of the gorge where it opens out to farmland, and is easily seen and portaged if necessary.</p><p>15 Mile Creek to James Rd is about 9 km.<br />For a longer trip, of about another 7 km, you can put in a km before the Heaphy Track road-end.</p><p>At higher flows (perhaps from 100-300, but certainly in the mid 200s) there is a playwave at the junction of Bainham Creek, 2.5 km before James Rd.  When working this rates up there with the best in the country.  It can be hard to get the flow right so have a backup plan, eg the lower Takaka in good flow is a fantastic play-run.</p><p>Be aware that the Aorere rises further and faster than just about any river in the country, and is to be avoided in major flood.</p><p>Salisbury Creek falls has been paddled, in case you're wondering.</p>"
"https://rivers.org.nz/nz/tasman/aorere/bainham-wave","Tasman","Aorere","Bainham wave","III","3","","","","Confluence of Aorere and Bainham Creek","Confluence of Aorere and Bainham Creek","<p>The wave is on the grade 2/3 Aorere gorge section, but you can also park and play. Impeccable eddy service is provided by the groynes built for flood protection.</p><p>For park and play ask at Gareth Scott's place, on the corner of Cook Rd 1.1 km up Aorere Valley Rd from the historic Langford's store. Or phone 524-8968.<br />Turn off at the double farm gate on the left another 400m up the valley, ie 1.5km from the store, and park 100m down the cattle track where it meets the river. Walk 200m upstream and you'll find a spot where you can see the wave and also easily duck under the electric fence.</p><p>https://www.google.co.nz/maps/@-40.7760287,172.5549872,269m/data=!3m1!1e3</p><p>The Aorere has huge floods, with an annual average high of 2000 cumecs and a record of 3500.   It goes up and down extremely quickly, more than just about any other river in the country. . 100 cumecs in 15 minutes is quite possible.   So to catch the wave you usually need to be there within hours of a decent downpour.  Keep a close eye on flow and rain graphs to figure out when.</p>"
"https://rivers.org.nz/nz/west-coast/arahura/arahura-gorges","West Coast","Arahura","Arahura Gorges","IV-V","4.5","15.2km","21m/km","4.5-8 hours","above third gorge near Newton Creek","Arahura Bridge above Milltown","<p>One of the most sought after and enjoyed runs in New Zealand. The Arahura rates as one of the great kayaking runs in the world. It has a wide range of runnable flow levels, great scenery, wild location and stunning whitewater. The Arahura is often described as one of the most 'fair' West Coast Rivers - what you see is what you get - there are very few nasties in disguise. It benchmarks good honest boating.<br />In 1986 Hugh Canard and two companions made what is thought to be the first kayak descent beginning near Olderog Creek. In 1993 Bruce Barnes investigated and ran Third Gorge. By the end of that season at least four other teams had sampled the delights and word began to spread. In 1984 Bruce and Mick et al flew in through Styx Saddle and paddled from the top of the river, adding a class III+ section that is good when there is a good flow in the river. Rafts even made the scene with the first descent by raft in 2002. In 2006 Dave Kwant and JJ added another chapter by flying to Harmen Hut and reported a funky 'gotta do it once' adventure in the upper Arahura Stream down to Styx Saddle and out in 6.5 hours with good water level!<br />From the normal put in busy class III-IV rock gardens lead into Third Gorge. Half a kilometre in is Curtain Call, one of the most photographed drops on the coast and worthy of all of them. Do what ever you do and smile for the camera(s). A couple of hundred metres further down is Dent Falls (the next most photographed drop on the coast). Scouting is easiest on the right side. Dent has been run any number of ways successfully, and unsuccessfully. Life stays busy for another half kilometre below Dent Falls before the intensity eases until Olderog Creek (there is a hut here).<br />Tight, class IV+ leads into Second Gorge and the technical crux of the Arahura. Billiards is a steep, punchy rapid with some testing hydraulics. Station a throw bagger next to them. Dave Mills lead the way in Billiards rescues on one trip by pulling two people (who were window shading in the hole) onto the rock, still in their boats, giving them the brief on the rest of the rapid before shoving them back in to finish off! This benevolent deed was unjustly rewarded in Jan 2005 when Dave swam at Billiards and went through a very long underwater sieve. There is an 'alternate route' down the left side and the 'alternate alternate' route on the far left. Another 200m of steep water and the gradient eases except for the one rapid everyone forgets - 'Alzheimer's'. Class I and II make up the 2-3km down to the Cesspit.<br />If you've already decided against the final gorge, the track is on river left about 150m before the gorge starts. If you miss this take out on river left above the 'pit' and thrash up the creek to the track. 15-20 minutes will see you back at the river for the final few kilometres of class II-III water to the take out. Expect a gradient of 36m/km in the first 5 kilometre easing to 21m/km.<br />Scouting the Cesspool entry is easy from the either side. There are a number of alternatives if choosing to paddle. The honest choice is to run down the middle and make the fine line across the turning curtain of water and open book corner.  Once landed hold onto your hat and avoid the hole (left) and cave (right) and the new rocks that have appeared. Or, drop in from the right over the rock ledge for the 3.5m boof (it's shallow in there so make sure to flat land), grovel around the tricky rock and do as the first option. Or, portage on the left side and seal launch into the big pool for the last class IV gorge with some fantastic moves.</p>"
"https://rivers.org.nz/nz/west-coast/arahura/milltown-gorge","West Coast","Arahura","Milltown Gorge","II-III","2.5","10km","","as long as you want","Anywhere along the road to the Arahura helicopter pick up","Arahura River Road end","<p>The Milltown Gorge on the lower Arahura has been used for years by teaching groups and offers a nice trip for novice paddlers on the coast rather than driving shuttles or sitting at helicopter pick ups. The gorge itself has a half dozen or so Class II+/III rapids with some fun little play spots and good practice eddies. Good play boating when really high.</p><p>The best way to shuttle is to ride a mountain bike along the forestry road which parallels the river (but has a locked gate you have to climb over) this takes about as long as driving and is better for your health! The car shuttle is a little complex and you"
"https://rivers.org.nz/nz/west-coast/arahura/styx-saddle-to-third-gorge","West Coast","Arahura","Styx Saddle to Third Gorge","III+","3.25","","","","Styx saddle","",""
"https://rivers.org.nz/nz/west-coast/arnold/kaimata-to-kokiri","West Coast","Arnold","Kaimata to Kokiri","II","2","5km","10m/km","1-2 hours","Power station at Kaimata","Road bridge at Kokiri","<p>The Arnold River drains from Lake Brunner, inland of Greymouth, and is a fantastic, mellow run ideal for after work or on a relaxing weekend.</p><p>The river flows quite quickly down a steady gradient with some great surf waves, rock splats and single channel rapids. The river is used extensively by locals, the local high school and Tai Poutini polytech for teaching their outdoor rec students.  It is always warm, and offers a fantastic venue, the only decent one on the Coast!, for teaching beginners. Watch out for the willow trees.</p><p>To get to the put-in; drive towards Reefton from Greymouth. Turn right at Stillwater and drive for about 6km to the signposted road on the left to the power station. Put in either down the grassy ramp to the right of the power station, or down the small gravel track that branches off to the right.</p><p>To get to the take-out; drive about 4km back towards Stillwater to the Kokiri freezing works on the right hand side. Turn to the right and park at the bridge.</p>"
"https://rivers.org.nz/nz/southland/arthur/lake-ada-to-milford-sound","Southland","Arthur","Lake Ada to Milford Sound","III-IV+","3.7","4km","10m/km","2-3 hours","Lake Ada","Milford Sound","The Arthur River flows into Milford Sound and provides a spectacular route for the famous Milford Track which follows it for almost its entire length. Needless to say the scenery is stunning and the waterfalls flowing off the valley sides after recent rain are not to be forgotten. Rick McGregor and Dave Kirk where probably the first to venture up the Arthur with a mind to paddling it in 1984. They also claim the first epic when Dave broke his paddle and swam. <p>The commonly paddled section is from the outlet of Lake Ada down to the Sound. There are two channels leaving the lake. Take the left one. In very high levels after very heavy rain the river can push into the big class V realm. If you are out of your depth the track is very close to the river the whole way.</p><p>Once leaving the lake there is a series of steep rocky rapids in the class III+ range. Be wary of undercut rocks and the odd trapped log in this section. Eventually the two channels join and you will feel the extra water suddenly through a series of big water moves and hydraulics. These lead to a long flat section just above the crux rapid. Scout from the rocks at the head of the rapid. Portage on river right in the slippery moss and big boulders if you need to.  A tricky entrance and drop into a cauldron requires some thought, as does the important cauldron exit. The rest of the rapid has many big holes so hold on to your hat and poke "
"https://rivers.org.nz/nz/canterbury/ashburton/ashburton","Canterbury","Ashburton","Ashburton","III-IV","3.5","","","","","",""
"https://rivers.org.nz/nz/canterbury/ashley/ashley-gorge","Canterbury","Ashley","Ashley Gorge","III+","3.25","12.5km","7.5m/km","2-5 hours","Ashley River Bridge on the Lees Valley Rd","Ashley Gorge campground","<p>Canterbury paddlers are blessed with this little gem on their back doorstep. The Ashley (Rakahuri) has been kayaked, canoed, tubed and liloed for decades. It feels like a wilderness trip because of the depth of the gorge and anyone walking out faces a lengthy epic.</p><p>The Ashley was a pleasant sanity preserver during my university years. We used to skip lectures and head up for an afternoon paddle, especially when there was a good flow in the river. In summer flows it can be a little scratchy, but fine for people just breaking out of beginner stage. (Don"
"https://rivers.org.nz/nz/canterbury/ashley/lees-valley-to-middle-bridge","Canterbury","Ashley","Lees Valley to Middle Bridge","II (III)","2.2","8.3km","5.2m/km","2-3 hours","Ashley River bridge at Lees Valley (Gillespie","Middle bridge (put-in for Ashley Gorge run)","<p>This run has a west coast feel "
"https://rivers.org.nz/nz/wellington/atiwhakatu-stream/atiwhakatu-to-holdsworth-lodge","Wellington","Atiwhakatu Stream","Atiwhakatu to Holdsworth Lodge","IV","4","","","","","","<p>Described by Fergus Bramley in NZ Canoeing Winter 2013 (13.2).</p><p>Park at the end of Mt Holdsworth Road, carry boats up Atiwhakatu on true right of river.</p><p>Takeout: <a href=""http://www.topomap.co.nz/NZTopoMap?v=2&ll=-40.906762,175.478948&z=14"" title=""http://www.topomap.co.nz/NZTopoMap?v=2&ll=-40.906762,175.478948&z=14"">http://www.topomap.co.nz/NZTopoMap?v=2&ll=-40.906762,175.478948&z=14</a></p>"
"https://rivers.org.nz/nz/marlborough/awatere/mt-gladstone-to-awapiri","Marlborough","Awatere","Mt Gladstone to Awapiri","I-II+","1.6","20km","","3-4 hours","Mt Gladstone bridge","Awapiri bridge","<p>The Awatere is a long river, rising in Molesworth Station and meeting the sea near Seddon. The headwaters include water flowing off the western slopes of the Inland Kaikoura range, but it is a dry part of New Zealand, so rain events present the best kayaking opportunities. The lower section of the Awatere"
"https://rivers.org.nz/nz/tasman/baton/baton-run","Tasman","Baton","Baton Run","III","3","5km","9m/km","1-2 hours depending on flow and put in","along open river flats 5km upstream from ford","ford 4km upstream from the Baton Bridge (c. 200m upstream from confluence)","<p>Characterised by a number of rapids through a series of picturesque gorges, the Baton River is almost a minature version of Nelsons Wairoa River. A major tributary of the Motueka River, the Baton is a wonderful outing with enjoyable class III paddling and numerous playspots. It"
"https://rivers.org.nz/nz/tasman/baton/upper-baton","Tasman","Baton","Upper Baton","III-IV","3.5","","","","","","<p>This run is a lot more technical than the lower Baton and includes a few undercut rocks, boulder gardens and a gradient of about 18 metres per kilometer for the best white water section. To get to the put in, you walk 7 kilometres from the conference of the Ellis and the Baton. Continue walking past the swing bridge until the track meets the river (about 2km upstream from the swing bridge). I am not sure what the white water is like upstream of this point. Take out at the Baton/EIlis conference. We did this in 3 hours.</p>"
"https://rivers.org.nz/nz/tasman/big/big-river-to-coast","Tasman","Big","Big River to Coast","IV-IV+","4.1","","30m/km","1-2 days","Where you can","Lagoon on West Coast","<p>Write up of first descent in CUMEC Magazine #6, p34-37 by Ben Robson.</p>"
"https://rivers.org.nz/nz/west-coast/blackball/smokeho-creek-to-blackball-creek-bridge","West Coast","Blackball","Smokeho Creek to Blackball Creek bridge","IV","4","4.5km","25m/km","1.5-2.5 hours","Smokeho Creek below swingbridge","Blackball Creek bridge","<p>Flowing out of the Southern Paparoas, this creek has been one of the Coast's best-kept secrets. Runnable only after reasonable rain, the creek affords numerous 1-2m drops and good class IV read and run.</p><p>It was first explored in 2003 by Trevor James, Andy Backhouse and Bob Cameron. It looked good but just needed the water. They didn't have to wait long - this is the west coast. Being fully aware of the potential for hidden logs and trees in this steep, treelined, corridor they treaded carefully and went in during low flows.  Over time the acceptable flow levels have raised so now it has been done in a wide range of flows. . Once on the main river you get a kilometre or so of class III+ to get warmed up. Things then steepen for 2.5km of mostly class IV/+ and there are a couple of ugly tree sieves that may require portaging and the crux rapid has a log railslide to boof then avoid a nasty cave with water pushing through it - you don't want to go into that! When things abruptly drop to class II it is all over and you just have to get to the bridge before you run out of water.</p><p><br />My first trip down was after a long drawn out day of waiting at the Blackball Hilton while a stationary front dumped over 160mm of rain in 24hours. At about 4.30pm we finally decided to go and hoped like crazy the level would drop quickly. At Smokeho Ck instead of a trickling current and crash and thrash to the river we had a miniature freight train ride to the confluence. The main creek was brown and charging as we picked our way very carefully down from (the few there were) eddy to eddy. We walked one tree sieve otherwise it was a great level to be in there. BUT - a swim was out of the question and good group boating skills were absolute necessary. In high water without prior knowledge it is solid class IV+ boating.<br /><br />To get to the take out: from Greymouth head north and cross the Cobden Bridge over the Grey River. Turn right and drive a short distance before a right turn again signposted to Taylorville and Blackball (along the Grey's true right bank). There is one more left turn (signposted Blackball) as the road heads back towards the Grey and Stillwater.  Keep on this, past the left turn for Blackball, and you will cross the Blackball Creek. Just bankfull and brown is a good flow. If it doesn't look like you can paddle/float down to the bridge it is probably too low and certainly will be by the time you get to the put in. Park on river left (there is another take out beyond the school which cuts out about 1.5km of the flat water at the end. You can find this for yourself).<br /><br />To get to the put-in: Drive back south to the signposted turnoff to Blackball. Drive up to Blackball and turn left at the Blackball Hilton. Follow this main street just out of town until the road splits and is sign posted "
"https://rivers.org.nz/nz/canterbury/boyle","Canterbury","Boyle","Engineers Camp to Windy Point","II-III","2.5","","","","","","<p>Beginner to intermediate water, wild and scenic character.</p>"
"https://rivers.org.nz/nz/tasman/buller/lake-rotoiti-to-sh63","Tasman","Buller","Lake Rotoiti to SH63","II-III+","2.6","2km","8m/km","30-60min","Buller Bridge on West Bay Road, Lake Rotoiti","Buller Bridge on SH63","<p>This run begins at Lake Rotoiti, the source of the mighty Buller, and is worth it if only to paddle from the lake to feel the birth of this majestic river. From start to finish, this run is one long rapid. Make sure you are able to make an eddy to actually get out at the bridge! The section is a good beginner trip with a slightly different feel to it. As a frenetic youth working at Rotoiti Lodge in St Arnaud I paddled this section more than 150 times, mostly on my own because there was no one else to paddle with and I couldn"
"https://rivers.org.nz/nz/tasman/buller/howard-to-harleys-rock","Tasman","Buller","Howard River Bridge to Harley's Rock Bridge","I-II","1.5","5km","6m/km","40-90 minutes","800m east of Howard River Bridge on SH63","Harley","<p>A pleasant cruise on an ever-growing river featuring plenty of straight-shot rapids with good eddies at the bottom. The put in can be used as the take out for the upper run. The section is often used for beginner courses and club trips and can be extended by continuing to a large gravel pit a couple of kilometres past Harley"
"https://rivers.org.nz/nz/tasman/buller/osullivans","Tasman","Buller","O'Sullivan's to Ariki","III","3","5.9km","6m/km","2-5 hours","picnic area at the top of O' Sullivan's Rapid","Ariki Falls (signposted) off SH6","<p>A classic of the Buller region, O"
"https://rivers.org.nz/nz/tasman/buller/whale-creek-to-ariki","Tasman","Buller","Whale Creek to Ariki","III","3","","","","","",""
